{
  "$schema": "https://stalk-ui.com/schema/v1/registry-item.json",
  "name": "checkbox",
  "type": "registry:ui",
  "dependencies": ["@radix-ui/react-checkbox", "@stalk-ui/preset", "lucide-react"],
  "registryDependencies": [],
  "files": [
    {
      "path": "src/components/ui/checkbox.tsx",
      "type": "registry:ui",
      "content": "'use client'\n\nimport * as CheckboxPrimitive from '@radix-ui/react-checkbox'\n// Stalk UI component - requires PandaCSS setup and @stalk-ui/preset.\nimport { Check, Minus } from 'lucide-react'\nimport { forwardRef, useId, useState } from 'react'\nimport { cx } from 'styled-system/css'\nimport { checkbox as checkboxRecipe } from 'styled-system/recipes'\n\nimport type { ComponentPropsWithoutRef, ComponentRef } from 'react'\n\nexport type CheckboxSize = (typeof checkboxRecipe.variantMap.size)[number]\ntype CheckedState = boolean | 'indeterminate'\n\nexport interface CheckboxProps extends Omit<\n  ComponentPropsWithoutRef<typeof CheckboxPrimitive.Root>,\n  'color'\n> {\n  invalid?: boolean\n  size?: CheckboxSize\n}\n\nconst ICON_SIZE: Record<CheckboxSize, number> = {\n  sm: 10,\n  md: 12,\n  lg: 16,\n}\n\nexport const Checkbox = /* @__PURE__ */ forwardRef<\n  ComponentRef<typeof CheckboxPrimitive.Root>,\n  CheckboxProps\n>(function Checkbox(\n  {\n    'aria-invalid': ariaInvalid,\n    checked,\n    className,\n    defaultChecked,\n    id: idProp,\n    invalid = false,\n    onCheckedChange,\n    size = 'md',\n    ...props\n  },\n  ref,\n) {\n  const isInvalid = invalid || ariaInvalid === true || ariaInvalid === 'true'\n  const generatedId = useId()\n  const id = idProp ?? generatedId\n  const styles = checkboxRecipe({ size })\n  const iconSize = ICON_SIZE[size]\n\n  const isControlled = checked !== undefined\n  const [internalState, setInternalState] = useState<CheckedState>(defaultChecked ?? false)\n\n  const effectiveState = isControlled ? checked : internalState\n  const isIndeterminate = effectiveState === 'indeterminate'\n\n  const handleCheckedChange = (next: CheckedState) => {\n    if (!isControlled) {\n      setInternalState(next)\n    }\n    onCheckedChange?.(next)\n  }\n\n  const checkedProps: { checked?: CheckedState; defaultChecked?: CheckedState } = isControlled\n    ? { checked }\n    : defaultChecked !== undefined\n      ? { defaultChecked }\n      : {}\n\n  return (\n    <CheckboxPrimitive.Root\n      ref={ref}\n      id={id}\n      aria-invalid={isInvalid ? true : ariaInvalid}\n      className={cx(styles.root, className)}\n      data-invalid={isInvalid ? '' : undefined}\n      {...checkedProps}\n      onCheckedChange={handleCheckedChange}\n      {...props}\n    >\n      <CheckboxPrimitive.Indicator asChild className={styles.indicator}>\n        {isIndeterminate ? (\n          <Minus aria-hidden=\"true\" height={iconSize} width={iconSize} strokeWidth={3} />\n        ) : (\n          <Check aria-hidden=\"true\" height={iconSize} width={iconSize} strokeWidth={3} />\n        )}\n      </CheckboxPrimitive.Indicator>\n    </CheckboxPrimitive.Root>\n  )\n})\n"
    }
  ],
  "stalk": {
    "schemaVersion": "1.0",
    "preset": {
      "semanticTokens": {},
      "recipes": ["checkbox"]
    },
    "packageDependencies": {
      "preset": "@stalk-ui/preset"
    },
    "pandaCodegen": true,
    "importAliases": {
      "styledSystem": "styled-system"
    }
  }
}
