{
  "$schema": "https://stalk-ui.com/schema/v1/registry-item.json",
  "name": "tour",
  "type": "registry:ui",
  "dependencies": ["@stalk-ui/preset"],
  "registryDependencies": ["button"],
  "files": [
    {
      "path": "src/components/ui/tour.tsx",
      "type": "registry:ui",
      "content": "'use client'\n\n'use client'\n\nimport { forwardRef, useEffect, useId, useLayoutEffect, useState } from 'react'\n// Stalk UI component - requires PandaCSS setup and @stalk-ui/preset.\nimport { createPortal } from 'react-dom'\nimport { tour as tourRecipe } from 'styled-system/recipes'\n\nimport { Button } from './button'\n\nimport type { CSSProperties, HTMLAttributes, ReactNode } from 'react'\n\nconst styles = /* @__PURE__ */ tourRecipe()\n\nexport interface TourStep {\n  /** CSS selector for the element this step spotlights. */\n  target: string\n  title: ReactNode\n  description?: ReactNode\n}\n\nexport interface TourProps extends HTMLAttributes<HTMLDivElement> {\n  steps: readonly TourStep[]\n  open: boolean\n  onOpenChange: (open: boolean) => void\n  /** Active step index (controlled); uncontrolled when omitted. */\n  step?: number\n  onStepChange?: (step: number) => void\n  /** Point an arrow from the step card at the spotlit target. Defaults to `true`. */\n  arrow?: boolean\n  nextLabel?: string\n  previousLabel?: string\n  skipLabel?: string\n  doneLabel?: string\n}\n\nconst SPOTLIGHT_PADDING = 6\nconst CARD_GAP = 10\nconst CARD_WIDTH = 320\n// Square notch, rotated 45°: half pokes above the card edge, half overlaps the\n// card (hiding the border segment beneath it).\nconst ARROW_SIZE = 12\n// Keep the arrow clear of the card's rounded corners.\nconst ARROW_INSET = 12\n\ninterface Rect {\n  height: number\n  left: number\n  top: number\n  width: number\n}\n\nconst rectFor = (selector: string): Rect | undefined => {\n  const element = document.querySelector(selector)\n  if (element === null) {\n    return undefined\n  }\n  const { height, left, top, width } = element.getBoundingClientRect()\n  return { height, left, top, width }\n}\n\n/**\n * Lightweight guided tour: spotlights each step's target (fixed overlay with a\n * cut-out shadow) and renders a step card beside it with next/back/skip.\n * Dependency-free; targets are plain CSS selectors so it works over any DOM.\n */\nexport const Tour = /* @__PURE__ */ forwardRef<HTMLDivElement, TourProps>(function Tour(\n  {\n    arrow = true,\n    className,\n    doneLabel = 'Done',\n    nextLabel = 'Next',\n    onOpenChange,\n    onStepChange,\n    open,\n    previousLabel = 'Back',\n    skipLabel = 'Skip',\n    step,\n    steps,\n    ...props\n  },\n  ref,\n) {\n  const titleId = useId()\n  const descriptionId = useId()\n  const [internalStep, setInternalStep] = useState(0)\n  const current = step ?? internalStep\n  const activeStep = steps[current]\n  const [rect, setRect] = useState<Rect | undefined>(undefined)\n\n  const goTo = (next: number) => {\n    setInternalStep(next)\n    onStepChange?.(next)\n  }\n\n  const close = () => {\n    onOpenChange(false)\n    goTo(0)\n  }\n\n  useLayoutEffect(() => {\n    if (!open || activeStep === undefined) {\n      return\n    }\n\n    const update = () => {\n      setRect(rectFor(activeStep.target))\n    }\n\n    update()\n    window.addEventListener('resize', update)\n    window.addEventListener('scroll', update, true)\n    return () => {\n      window.removeEventListener('resize', update)\n      window.removeEventListener('scroll', update, true)\n    }\n  }, [open, activeStep])\n\n  useEffect(() => {\n    if (!open) {\n      return\n    }\n\n    const onKeyDown = (event: globalThis.KeyboardEvent) => {\n      if (event.key === 'Escape') {\n        close()\n      }\n    }\n\n    document.addEventListener('keydown', onKeyDown)\n    return () => {\n      document.removeEventListener('keydown', onKeyDown)\n    }\n    // eslint-disable-next-line react-hooks/exhaustive-deps -- close is stable per render intent\n  }, [open])\n\n  if (!open || activeStep === undefined || typeof document === 'undefined') {\n    return null\n  }\n\n  const spotlightStyle: CSSProperties | undefined =\n    rect === undefined\n      ? undefined\n      : {\n          height: rect.height + SPOTLIGHT_PADDING * 2,\n          left: rect.left - SPOTLIGHT_PADDING,\n          top: rect.top - SPOTLIGHT_PADDING,\n          width: rect.width + SPOTLIGHT_PADDING * 2,\n        }\n\n  // Below the target, clamped to the viewport; centered fallback without a rect.\n  const cardLeft =\n    rect === undefined\n      ? undefined\n      : Math.max(CARD_GAP, Math.min(rect.left, window.innerWidth - CARD_WIDTH - CARD_GAP))\n  const cardTop =\n    rect === undefined ? undefined : rect.top + rect.height + SPOTLIGHT_PADDING + CARD_GAP\n  const cardStyle: CSSProperties =\n    cardLeft === undefined || cardTop === undefined\n      ? { left: '50%', top: '50%', transform: 'translate(-50%, -50%)' }\n      : { left: cardLeft, top: cardTop }\n\n  const arrowStyle: CSSProperties | undefined =\n    !arrow || rect === undefined || cardLeft === undefined || cardTop === undefined\n      ? undefined\n      : {\n          left: Math.min(\n            Math.max(rect.left + rect.width / 2 - ARROW_SIZE / 2, cardLeft + ARROW_INSET),\n            cardLeft +\n              Math.min(CARD_WIDTH, window.innerWidth - CARD_GAP * 2) -\n              ARROW_SIZE -\n              ARROW_INSET,\n          ),\n          top: cardTop - ARROW_SIZE / 2,\n        }\n\n  const last = current === steps.length - 1\n\n  return createPortal(\n    <div ref={ref} className={className} {...props}>\n      {spotlightStyle !== undefined ? (\n        <div aria-hidden className={styles.spotlight} style={spotlightStyle} />\n      ) : null}\n      <div\n        role=\"dialog\"\n        aria-modal=\"false\"\n        aria-labelledby={titleId}\n        aria-describedby={activeStep.description === undefined ? undefined : descriptionId}\n        className={styles.content}\n        style={cardStyle}\n      >\n        <p className={styles.title} id={titleId}>\n          {activeStep.title}\n        </p>\n        {activeStep.description !== undefined ? (\n          <p className={styles.description} id={descriptionId}>\n            {activeStep.description}\n          </p>\n        ) : null}\n        <div className={styles.footer}>\n          <span className={styles.counter}>\n            {current + 1} / {steps.length}\n          </span>\n          <div className={styles.actions}>\n            <Button size=\"sm\" variant=\"ghost\" onClick={close}>\n              {skipLabel}\n            </Button>\n            {current > 0 ? (\n              <Button\n                size=\"sm\"\n                variant=\"outline\"\n                onClick={() => {\n                  goTo(current - 1)\n                }}\n              >\n                {previousLabel}\n              </Button>\n            ) : null}\n            <Button\n              size=\"sm\"\n              onClick={() => {\n                if (last) {\n                  close()\n                } else {\n                  goTo(current + 1)\n                }\n              }}\n            >\n              {last ? doneLabel : nextLabel}\n            </Button>\n          </div>\n        </div>\n      </div>\n      {/* After the card in DOM: its fill overlays the card's top border, so the\n          bordered notch reads as part of the card. */}\n      {arrowStyle !== undefined ? (\n        <div aria-hidden className={styles.arrow} style={arrowStyle} />\n      ) : null}\n    </div>,\n    document.body,\n  )\n})\n"
    }
  ],
  "stalk": {
    "schemaVersion": "1.0",
    "preset": {
      "semanticTokens": {},
      "recipes": ["tour"]
    },
    "packageDependencies": {
      "preset": "@stalk-ui/preset"
    },
    "pandaCodegen": true,
    "importAliases": {
      "styledSystem": "styled-system"
    }
  }
}
