{
  "$schema": "https://stalk-ui.com/schema/v1/registry-item.json",
  "name": "text",
  "type": "registry:ui",
  "dependencies": ["@stalk-ui/preset"],
  "registryDependencies": ["tones"],
  "files": [
    {
      "path": "src/components/ui/text.tsx",
      "type": "registry:ui",
      "content": "import { forwardRef } from 'react'\nimport { css, cx } from 'styled-system/css'\nimport { text as textRecipe } from 'styled-system/recipes'\n\nimport type { Tone } from '../../lib/stalk-ui/tones'\nimport type { HTMLAttributes } from 'react'\n\nexport type TextSize = (typeof textRecipe.variantMap.size)[number]\nexport type TextWeight = (typeof textRecipe.variantMap.weight)[number]\nexport type TextAlign = (typeof textRecipe.variantMap.align)[number]\n/** Neutral foreground colours, mapped to `fg.*` semantic tokens. */\nexport type TextColor = 'default' | 'muted' | 'subtle'\n/** Elements the inline/block text primitive is allowed to render as. */\nexport type TextElement = 'p' | 'span' | 'div' | 'label'\n\nexport interface TextProps extends HTMLAttributes<HTMLElement> {\n  /** Element to render. Defaults to `p`. */\n  as?: TextElement\n  /** Neutral foreground colour. Ignored when `tone` is set. Defaults to `default`. */\n  color?: TextColor\n  /** Clamp to N lines with a trailing ellipsis (multi-line). */\n  lineClamp?: number\n  size?: TextSize\n  /** Selects a semantic status palette, overriding `color`. */\n  tone?: Tone\n  /** Truncate to a single line with a trailing ellipsis. */\n  truncate?: boolean\n  align?: TextAlign\n  weight?: TextWeight\n}\n\nconst resolveColor = (color: TextColor, tone: Tone | undefined): string | undefined => {\n  if (tone !== undefined) return css({ colorPalette: tone, color: 'colorPalette.text' })\n  if (color === 'default') return undefined\n  return css({ color: `fg.${color}` })\n}\n\nconst TextBase = /* @__PURE__ */ forwardRef<HTMLElement, TextProps>(function Text(\n  {\n    align,\n    as: Component = 'p',\n    className,\n    color = 'default',\n    lineClamp,\n    size = 'body',\n    tone,\n    truncate = false,\n    weight = 'regular',\n    ...props\n  },\n  ref,\n) {\n  return (\n    <Component\n      // The element union is intentionally narrow; the cast keeps the shared\n      // HTMLElement ref/attribute typing without a per-element generic.\n      ref={ref as never}\n      className={cx(\n        textRecipe({ align, size, truncate, weight }),\n        resolveColor(color, tone),\n        lineClamp !== undefined ? css({ lineClamp: String(lineClamp) }) : undefined,\n        className,\n      )}\n      {...props}\n    />\n  )\n})\n\nexport type StrongProps = HTMLAttributes<HTMLElement>\n\nexport const Strong = /* @__PURE__ */ forwardRef<HTMLElement, StrongProps>(function Strong(\n  { className, ...props },\n  ref,\n) {\n  return <strong ref={ref} className={cx(css({ fontWeight: 'bold' }), className)} {...props} />\n})\n\nexport type EmProps = HTMLAttributes<HTMLElement>\n\nexport const Em = /* @__PURE__ */ forwardRef<HTMLElement, EmProps>(function Em(\n  { className, ...props },\n  ref,\n) {\n  return <em ref={ref} className={cx(css({ fontStyle: 'italic' }), className)} {...props} />\n})\n\nexport type QuoteProps = HTMLAttributes<HTMLQuoteElement>\n\n// Inline quotation. The element carries the semantics; the UA supplies\n// locale-aware quotation marks via `q::before`/`::after`.\nexport const Quote = /* @__PURE__ */ forwardRef<HTMLQuoteElement, QuoteProps>(function Quote(\n  { className, ...props },\n  ref,\n) {\n  return <q ref={ref} className={className} {...props} />\n})\n\nexport const Text = /* @__PURE__ */ Object.assign(TextBase, {\n  Em,\n  Quote,\n  Strong,\n})\n"
    }
  ],
  "stalk": {
    "schemaVersion": "1.0",
    "preset": {
      "semanticTokens": {},
      "recipes": ["text"]
    },
    "packageDependencies": {
      "preset": "@stalk-ui/preset"
    },
    "pandaCodegen": true,
    "importAliases": {
      "styledSystem": "styled-system"
    }
  }
}
