{
  "$schema": "https://stalk-ui.com/schema/v1/registry-item.json",
  "name": "chart",
  "type": "registry:ui",
  "dependencies": ["@stalk-ui/preset"],
  "registryDependencies": [],
  "files": [
    {
      "path": "src/components/ui/chart.tsx",
      "type": "registry:ui",
      "content": "'use client'\n\nimport { createContext, forwardRef, useContext } from 'react'\nimport { cx } from 'styled-system/css'\nimport { chart as chartRecipe } from 'styled-system/recipes'\n\nimport type { ComponentType, CSSProperties, HTMLAttributes, ReactNode } from 'react'\n\nconst styles = /* @__PURE__ */ chartRecipe()\n\nexport interface ChartSeriesConfig {\n  color?: string\n  icon?: ComponentType\n  label?: ReactNode\n}\n\n/** Maps each data series key to a label and a color used for the `--color-<key>` variable. */\nexport type ChartConfig = Record<string, ChartSeriesConfig>\n\ninterface ChartContextValue {\n  config: ChartConfig\n}\n\nconst ChartContext = createContext<ChartContextValue | null>(null)\n\nexport function useChart(): ChartContextValue {\n  const context = useContext(ChartContext)\n  if (context === null) {\n    throw new Error('useChart must be used within a <ChartContainer>.')\n  }\n  return context\n}\n\nexport interface ChartContainerProps extends HTMLAttributes<HTMLDivElement> {\n  config: ChartConfig\n}\n\n// Option B: this is a theming contract, not a recharts wrapper. The consumer\n// renders their own recharts tree (e.g. a ResponsiveContainer) as `children`;\n// recharts is never imported or bundled here. ChartContainer exposes each series\n// color as a `--color-<key>` CSS variable so recharts elements can reference it.\nexport const ChartContainer = /* @__PURE__ */ forwardRef<HTMLDivElement, ChartContainerProps>(\n  function ChartContainer({ children, className, config, style, ...props }, ref) {\n    const colorVars: Record<string, string> = {}\n    for (const [key, series] of Object.entries(config)) {\n      if (series.color) {\n        colorVars[`--color-${key}`] = series.color\n      }\n    }\n    return (\n      <ChartContext.Provider value={{ config }}>\n        <div\n          ref={ref}\n          className={cx(styles.container, className)}\n          data-chart=\"\"\n          style={{ ...colorVars, ...style }}\n          {...props}\n        >\n          {children}\n        </div>\n      </ChartContext.Provider>\n    )\n  },\n)\n\ninterface TooltipPayloadEntry {\n  color?: string\n  dataKey?: string | number\n  name?: string | number\n  value?: number | string\n  payload?: Record<string, unknown>\n}\n\nexport interface ChartTooltipContentProps extends HTMLAttributes<HTMLDivElement> {\n  active?: boolean\n  hideIndicator?: boolean\n  hideLabel?: boolean\n  label?: ReactNode\n  /** recharts passes its hovered points here. */\n  payload?: TooltipPayloadEntry[]\n}\n\nconst seriesKey = (entry: TooltipPayloadEntry): string => String(entry.dataKey ?? entry.name ?? '')\n\nexport const ChartTooltipContent = /* @__PURE__ */ forwardRef<\n  HTMLDivElement,\n  ChartTooltipContentProps\n>(function ChartTooltipContent(\n  { active, className, hideIndicator = false, hideLabel = false, label, payload, ...props },\n  ref,\n) {\n  const { config } = useChart()\n  if (!active || !payload || payload.length === 0) {\n    return null\n  }\n  return (\n    <div ref={ref} className={cx(styles.tooltip, className)} {...props}>\n      {hideLabel ? null : <div className={styles.tooltipLabel}>{label}</div>}\n      {payload.map((entry, index) => {\n        const key = seriesKey(entry)\n        const series = config[key]\n        const color = series?.color ?? entry.color\n        return (\n          <div key={`${key}-${String(index)}`} className={styles.tooltipRow}>\n            {hideIndicator ? null : (\n              <span\n                className={styles.tooltipIndicator}\n                style={{ '--color-indicator': color } as CSSProperties}\n              />\n            )}\n            <span>{series?.label ?? entry.name ?? key}</span>\n            <span>{entry.value}</span>\n          </div>\n        )\n      })}\n    </div>\n  )\n})\n\ninterface LegendPayloadEntry {\n  color?: string\n  dataKey?: string | number\n  value?: string\n}\n\nexport interface ChartLegendContentProps extends HTMLAttributes<HTMLDivElement> {\n  /** recharts passes its legend entries here. */\n  payload?: LegendPayloadEntry[]\n}\n\nexport const ChartLegendContent = /* @__PURE__ */ forwardRef<\n  HTMLDivElement,\n  ChartLegendContentProps\n>(function ChartLegendContent({ className, payload, ...props }, ref) {\n  const { config } = useChart()\n  if (!payload || payload.length === 0) {\n    return null\n  }\n  return (\n    <div ref={ref} className={cx(styles.legend, className)} {...props}>\n      {payload.map((entry, index) => {\n        const key = String(entry.dataKey ?? entry.value ?? index)\n        const series = config[key]\n        const color = series?.color ?? entry.color\n        return (\n          <div key={key}>\n            <span\n              className={styles.tooltipIndicator}\n              style={{ '--color-indicator': color } as CSSProperties}\n            />\n            <span>{series?.label ?? entry.value ?? key}</span>\n          </div>\n        )\n      })}\n    </div>\n  )\n})\n\ntype ChartNamespace = typeof ChartContainer & {\n  Container: typeof ChartContainer\n  LegendContent: typeof ChartLegendContent\n  TooltipContent: typeof ChartTooltipContent\n}\n\nexport const Chart: ChartNamespace = /* @__PURE__ */ Object.assign(ChartContainer, {\n  Container: ChartContainer,\n  LegendContent: ChartLegendContent,\n  TooltipContent: ChartTooltipContent,\n})\n"
    }
  ],
  "stalk": {
    "schemaVersion": "1.0",
    "preset": {
      "semanticTokens": {},
      "recipes": ["chart"]
    },
    "packageDependencies": {
      "preset": "@stalk-ui/preset"
    },
    "pandaCodegen": true,
    "importAliases": {
      "styledSystem": "styled-system"
    }
  }
}
