{
  "$schema": "https://stalk-ui.com/schema/v1/registry-item.json",
  "name": "toggle",
  "type": "registry:ui",
  "dependencies": ["@radix-ui/react-toggle", "@radix-ui/react-toggle-group", "@stalk-ui/preset"],
  "registryDependencies": [],
  "files": [
    {
      "path": "src/components/ui/toggle.tsx",
      "type": "registry:ui",
      "content": "'use client'\n\nimport * as TogglePrimitive from '@radix-ui/react-toggle'\n// Stalk UI component - requires PandaCSS setup and @stalk-ui/preset.\nimport * as ToggleGroupPrimitive from '@radix-ui/react-toggle-group'\nimport { createContext, forwardRef, useContext, useMemo } from 'react'\nimport { css, cx } from 'styled-system/css'\nimport { toggle as toggleRecipe } from 'styled-system/recipes'\n\nimport type { Tone } from './tones'\nimport type { ComponentPropsWithoutRef, ComponentRef } from 'react'\n\nexport type ToggleSize = (typeof toggleRecipe.variantMap.size)[number]\nexport type ToggleVariant = (typeof toggleRecipe.variantMap.variant)[number]\nexport type ToggleRadius = (typeof toggleRecipe.variantMap.radius)[number]\nexport type ToggleTone = Tone\n\ninterface ToggleGroupContextValue {\n  attached: boolean\n  radius: ToggleRadius\n  size: ToggleSize\n  tone: ToggleTone\n  variant: ToggleVariant\n}\n\nconst ToggleGroupContext = /* @__PURE__ */ createContext<ToggleGroupContextValue | null>(null)\n\nexport interface ToggleProps extends ComponentPropsWithoutRef<typeof TogglePrimitive.Root> {\n  radius?: ToggleRadius\n  size?: ToggleSize\n  /** Selects the semantic color palette used when the toggle is on. */\n  tone?: ToggleTone\n  variant?: ToggleVariant\n}\n\nexport const Toggle = /* @__PURE__ */ forwardRef<\n  ComponentRef<typeof TogglePrimitive.Root>,\n  ToggleProps\n>(function Toggle(\n  { className, radius = 'md', size = 'md', tone = 'accent', variant = 'outline', ...props },\n  ref,\n) {\n  const styles = toggleRecipe({ radius, size, variant })\n  return (\n    <TogglePrimitive.Root\n      ref={ref}\n      className={cx(styles.item, css({ colorPalette: tone }), className)}\n      {...props}\n    />\n  )\n})\n\ntype ToggleGroupSingleProps = ComponentPropsWithoutRef<typeof ToggleGroupPrimitive.Root> & {\n  type: 'single'\n  value?: string\n  defaultValue?: string\n  onValueChange?: (value: string) => void\n}\n\ntype ToggleGroupMultipleProps = ComponentPropsWithoutRef<typeof ToggleGroupPrimitive.Root> & {\n  type: 'multiple'\n  value?: string[]\n  defaultValue?: string[]\n  onValueChange?: (value: string[]) => void\n}\n\nexport type ToggleGroupProps = (ToggleGroupSingleProps | ToggleGroupMultipleProps) & {\n  /** When true, items sit flush against each other forming a segmented control. */\n  attached?: boolean\n  radius?: ToggleRadius\n  size?: ToggleSize\n  /** Selects the semantic color palette used when an item is on. */\n  tone?: ToggleTone\n  variant?: ToggleVariant\n}\n\nexport const ToggleGroup = /* @__PURE__ */ forwardRef<\n  ComponentRef<typeof ToggleGroupPrimitive.Root>,\n  ToggleGroupProps\n>(function ToggleGroup(\n  {\n    attached = false,\n    className,\n    radius = 'md',\n    size = 'md',\n    tone = 'accent',\n    variant = 'outline',\n    ...props\n  },\n  ref,\n) {\n  const styles = toggleRecipe({ attached, radius, size, variant })\n  const ctx = useMemo<ToggleGroupContextValue>(\n    () => ({ attached, radius, size, tone, variant }),\n    [attached, radius, size, tone, variant],\n  )\n  return (\n    <ToggleGroupContext.Provider value={ctx}>\n      <ToggleGroupPrimitive.Root\n        ref={ref}\n        className={cx(styles.root, css({ colorPalette: tone }), className)}\n        {...props}\n      />\n    </ToggleGroupContext.Provider>\n  )\n})\n\nexport interface ToggleGroupItemProps\n  extends ComponentPropsWithoutRef<typeof ToggleGroupPrimitive.Item> {\n  /** Override inherited group settings on a per-item basis. */\n  radius?: ToggleRadius\n  size?: ToggleSize\n  variant?: ToggleVariant\n}\n\nexport const ToggleGroupItem = /* @__PURE__ */ forwardRef<\n  ComponentRef<typeof ToggleGroupPrimitive.Item>,\n  ToggleGroupItemProps\n>(function ToggleGroupItem(\n  { className, radius: radiusProp, size: sizeProp, variant: variantProp, ...props },\n  ref,\n) {\n  const ctx = useContext(ToggleGroupContext)\n  const size = sizeProp ?? ctx?.size ?? 'md'\n  const radius = radiusProp ?? ctx?.radius ?? 'md'\n  const variant = variantProp ?? ctx?.variant ?? 'outline'\n  const attached = ctx?.attached ?? false\n  const styles = toggleRecipe({ attached, radius, size, variant })\n  return (\n    <ToggleGroupPrimitive.Item ref={ref} className={cx(styles.item, className)} {...props} />\n  )\n})\n"
    }
  ],
  "stalk": {
    "schemaVersion": "1.0",
    "preset": {
      "semanticTokens": {},
      "recipes": ["toggle"]
    },
    "packageDependencies": {
      "preset": "@stalk-ui/preset"
    },
    "pandaCodegen": true,
    "importAliases": {
      "styledSystem": "styled-system"
    }
  }
}
