{
  "$schema": "https://stalk-ui.com/schema/v1/registry-item.json",
  "name": "select",
  "type": "registry:ui",
  "dependencies": ["@radix-ui/react-select", "@stalk-ui/preset", "lucide-react"],
  "registryDependencies": [],
  "files": [
    {
      "path": "src/components/ui/select.tsx",
      "type": "registry:ui",
      "content": "'use client'\n\nimport * as SelectPrimitive from '@radix-ui/react-select'\n// Stalk UI component - requires PandaCSS setup and @stalk-ui/preset.\nimport { Check, ChevronDown } from 'lucide-react'\nimport { forwardRef } from 'react'\nimport { css, cx } from 'styled-system/css'\nimport { select as selectRecipe } from 'styled-system/recipes'\n\nimport type { ComponentPropsWithoutRef, ComponentRef, ReactNode } from 'react'\n\nconst itemEndClass = /* @__PURE__ */ css({ color: 'fg.muted', marginInlineStart: 'auto' })\n\nexport type SelectSize = (typeof selectRecipe.variantMap.size)[number]\n\nexport const SelectRoot = SelectPrimitive.Root\nexport const SelectGroup = SelectPrimitive.Group\nexport const SelectValue = SelectPrimitive.Value\nexport const SelectPortal = SelectPrimitive.Portal\n\nexport interface SelectTriggerProps extends ComponentPropsWithoutRef<\n  typeof SelectPrimitive.Trigger\n> {\n  /** Stretch the trigger to fill its container; default is content-width. */\n  fullWidth?: boolean\n  invalid?: boolean\n  size?: SelectSize\n}\n\nexport const SelectTrigger = /* @__PURE__ */ forwardRef<\n  ComponentRef<typeof SelectPrimitive.Trigger>,\n  SelectTriggerProps\n>(function SelectTrigger(\n  {\n    'aria-invalid': ariaInvalid,\n    children,\n    className,\n    fullWidth = false,\n    invalid = false,\n    size = 'md',\n    ...props\n  },\n  ref,\n) {\n  const isInvalid = invalid || ariaInvalid === true || ariaInvalid === 'true'\n  const styles = selectRecipe({ fullWidth, size })\n\n  return (\n    <SelectPrimitive.Trigger\n      ref={ref}\n      aria-invalid={isInvalid ? true : ariaInvalid}\n      className={cx(styles.trigger, className)}\n      data-invalid={isInvalid ? '' : undefined}\n      {...props}\n    >\n      {children}\n      <SelectPrimitive.Icon asChild>\n        <ChevronDown aria-hidden=\"true\" height={16} width={16} />\n      </SelectPrimitive.Icon>\n    </SelectPrimitive.Trigger>\n  )\n})\nexport type SelectContentProps = ComponentPropsWithoutRef<typeof SelectPrimitive.Content>\n\nexport const SelectContent = /* @__PURE__ */ forwardRef<\n  ComponentRef<typeof SelectPrimitive.Content>,\n  SelectContentProps\n>(function SelectContent({ children, className, position = 'popper', ...props }, ref) {\n  const styles = /* @__PURE__ */ selectRecipe()\n\n  return (\n    <SelectPrimitive.Portal>\n      <SelectPrimitive.Content\n        ref={ref}\n        className={cx(styles.content, className)}\n        position={position}\n        {...props}\n      >\n        <SelectPrimitive.Viewport className={styles.viewport}>{children}</SelectPrimitive.Viewport>\n      </SelectPrimitive.Content>\n    </SelectPrimitive.Portal>\n  )\n})\nexport interface SelectItemProps extends ComponentPropsWithoutRef<typeof SelectPrimitive.Item> {\n  /** Trailing content aligned to the inline-end of the option (e.g. meta/shortcut). */\n  endContent?: ReactNode\n}\n\nexport const SelectItem = /* @__PURE__ */ forwardRef<\n  ComponentRef<typeof SelectPrimitive.Item>,\n  SelectItemProps\n>(function SelectItem({ children, className, endContent, ...props }, ref) {\n  const styles = /* @__PURE__ */ selectRecipe()\n\n  return (\n    <SelectPrimitive.Item ref={ref} className={cx(styles.item, className)} {...props}>\n      <SelectPrimitive.ItemIndicator className={styles.itemIndicator}>\n        <Check aria-hidden=\"true\" height={14} width={14} />\n      </SelectPrimitive.ItemIndicator>\n      <SelectPrimitive.ItemText>{children}</SelectPrimitive.ItemText>\n      {endContent === undefined ? null : <span className={itemEndClass}>{endContent}</span>}\n    </SelectPrimitive.Item>\n  )\n})\nexport const SelectLabel = /* @__PURE__ */ forwardRef<\n  ComponentRef<typeof SelectPrimitive.Label>,\n  ComponentPropsWithoutRef<typeof SelectPrimitive.Label>\n>(function SelectLabel({ className, ...props }, ref) {\n  const styles = /* @__PURE__ */ selectRecipe()\n  return <SelectPrimitive.Label ref={ref} className={cx(styles.label, className)} {...props} />\n})\nexport const SelectSeparator = /* @__PURE__ */ forwardRef<\n  ComponentRef<typeof SelectPrimitive.Separator>,\n  ComponentPropsWithoutRef<typeof SelectPrimitive.Separator>\n>(function SelectSeparator({ className, ...props }, ref) {\n  const styles = /* @__PURE__ */ selectRecipe()\n  return (\n    <SelectPrimitive.Separator ref={ref} className={cx(styles.separator, className)} {...props} />\n  )\n})\n/** A selectable empty value: Radix Select forbids `value=\"\"`, so an option whose\n *  value is the empty string maps to this sentinel internally and back out in\n *  `onValueChange` / the controlled `value`. */\nconst EMPTY_VALUE = '\u0000stalk-empty'\nconst toInternal = (value: string) => (value === '' ? EMPTY_VALUE : value)\nconst fromInternal = (value: string) => (value === EMPTY_VALUE ? '' : value)\n\nexport interface SelectOption {\n  /** Visible option content. */\n  label: ReactNode\n  /** Option value. The empty string is allowed and handled via a sentinel. */\n  value: string\n  disabled?: boolean\n}\n\nexport interface SelectFieldProps {\n  options: readonly SelectOption[]\n  value?: string\n  defaultValue?: string\n  onValueChange?: (value: string) => void\n  placeholder?: ReactNode\n  size?: SelectSize\n  /** Stretch the trigger to fill its container; default is content-width. */\n  fullWidth?: boolean\n  invalid?: boolean\n  disabled?: boolean\n  name?: string\n  required?: boolean\n  'aria-label'?: string\n  triggerClassName?: string\n}\n\n/**\n * Thin first-party convenience over the compound `Select.*` for the common\n * value + onValueChange + options case. Bakes in the empty-value sentinel so an\n * option with `value: ''` is selectable (Radix forbids it natively).\n */\nexport const SelectField = /* @__PURE__ */ forwardRef<\n  ComponentRef<typeof SelectPrimitive.Trigger>,\n  SelectFieldProps\n>(function SelectField(\n  {\n    'aria-label': ariaLabel,\n    defaultValue,\n    disabled = false,\n    fullWidth = false,\n    invalid = false,\n    name,\n    onValueChange,\n    options,\n    placeholder,\n    required = false,\n    size = 'md',\n    triggerClassName,\n    value,\n  },\n  ref,\n) {\n  return (\n    <SelectRoot\n      disabled={disabled}\n      onValueChange={(next) => onValueChange?.(fromInternal(next))}\n      required={required}\n      {...(name !== undefined ? { name } : {})}\n      {...(value !== undefined ? { value: toInternal(value) } : {})}\n      {...(defaultValue !== undefined ? { defaultValue: toInternal(defaultValue) } : {})}\n    >\n      <SelectTrigger\n        ref={ref}\n        aria-label={ariaLabel}\n        className={triggerClassName}\n        fullWidth={fullWidth}\n        invalid={invalid}\n        size={size}\n      >\n        <SelectValue placeholder={placeholder} />\n      </SelectTrigger>\n      <SelectContent>\n        {options.map((option) => (\n          <SelectItem\n            key={option.value}\n            disabled={option.disabled ?? false}\n            value={toInternal(option.value)}\n          >\n            {option.label}\n          </SelectItem>\n        ))}\n      </SelectContent>\n    </SelectRoot>\n  )\n})\n\nexport const Select = /* @__PURE__ */ Object.assign(SelectRoot, {\n  Content: SelectContent,\n  Group: SelectGroup,\n  Item: SelectItem,\n  Label: SelectLabel,\n  Portal: SelectPortal,\n  Root: SelectRoot,\n  Separator: SelectSeparator,\n  Trigger: SelectTrigger,\n  Value: SelectValue,\n})\n"
    }
  ],
  "stalk": {
    "schemaVersion": "1.0",
    "preset": {
      "semanticTokens": {},
      "recipes": ["select"]
    },
    "packageDependencies": {
      "preset": "@stalk-ui/preset"
    },
    "pandaCodegen": true,
    "importAliases": {
      "styledSystem": "styled-system"
    }
  }
}
