{
  "$schema": "https://stalk-ui.com/schema/v1/registry-item.json",
  "name": "input",
  "type": "registry:ui",
  "dependencies": ["@stalk-ui/preset"],
  "registryDependencies": [],
  "files": [
    {
      "path": "src/components/ui/input.tsx",
      "type": "registry:ui",
      "content": "'use client'\n\nimport { createContext, forwardRef, useCallback, useContext, useMemo, useRef } from 'react'\n// Stalk UI component - requires PandaCSS setup and @stalk-ui/preset.\nimport { cx } from 'styled-system/css'\nimport { input as inputRecipe } from 'styled-system/recipes'\n\nimport type {\n  ComponentPropsWithoutRef,\n  HTMLAttributes,\n  InputHTMLAttributes,\n  PointerEvent,\n  ReactNode,\n  RefObject,\n} from 'react'\n\nexport type InputSize = (typeof inputRecipe.variantMap.size)[number]\nexport type InputAlign = (typeof inputRecipe.variantMap.align)[number]\nexport type InputSlotSide = 'start' | 'end'\n\ninterface InputRootContextValue {\n  align: InputAlign\n  disabled: boolean\n  inputRef: RefObject<HTMLInputElement | null>\n  invalid: boolean\n  size: InputSize\n  styles: ReturnType<typeof inputRecipe>\n}\n\nconst InputRootContext = createContext<InputRootContextValue | null>(null)\n\nconst useInputRootContext = (consumer: string): InputRootContextValue => {\n  const context = useContext(InputRootContext)\n\n  if (context === null) {\n    throw new Error(`${consumer} must be rendered inside <Input.Root>.`)\n  }\n\n  return context\n}\n\nconst composeRefs =\n  <T,>(...refs: (((value: T | null) => void) | RefObject<T | null> | null | undefined)[]) =>\n  (value: T | null) => {\n    for (const ref of refs) {\n      if (typeof ref === 'function') {\n        ref(value)\n      } else if (ref !== null && ref !== undefined) {\n        ref.current = value\n      }\n    }\n  }\n\nconst supportsSelectionRange = (input: HTMLInputElement) => {\n  const type = input.type\n  return (\n    type === 'text' || type === 'search' || type === 'url' || type === 'tel' || type === 'password'\n  )\n}\n\nexport interface InputRootOwnProps {\n  align?: InputAlign\n  disabled?: boolean\n  invalid?: boolean\n  size?: InputSize\n}\n\nexport interface InputRootProps\n  extends InputRootOwnProps, Omit<HTMLAttributes<HTMLDivElement>, keyof InputRootOwnProps> {}\n\nexport const InputRoot = forwardRef<HTMLDivElement, InputRootProps>(\n  (\n    {\n      'aria-invalid': ariaInvalid,\n      align = 'start',\n      children,\n      className,\n      disabled = false,\n      invalid: invalidProp = false,\n      onPointerDown,\n      size = 'md',\n      ...props\n    },\n    ref,\n  ) => {\n    const isInvalid = invalidProp || ariaInvalid === true || ariaInvalid === 'true'\n    const inputRef = useRef<HTMLInputElement | null>(null)\n    const styles = useMemo(\n      () => inputRecipe({ align, disabled, invalid: isInvalid, size }),\n      [align, disabled, isInvalid, size],\n    )\n\n    const handlePointerDown = useCallback(\n      (event: PointerEvent<HTMLDivElement>) => {\n        onPointerDown?.(event)\n\n        if (event.defaultPrevented) {\n          return\n        }\n\n        const target = event.target as HTMLElement | null\n\n        if (target === null) {\n          return\n        }\n\n        if (target.closest('input, textarea, select, button, a, [role=\"button\"]') !== null) {\n          return\n        }\n\n        const input = inputRef.current\n\n        if (input === null || input.disabled) {\n          return\n        }\n\n        const slot = target.closest<HTMLElement>('[data-stalk-input-slot]')\n        const placeAtEnd = slot?.dataset.side !== 'start'\n        const cursorPosition = placeAtEnd ? input.value.length : 0\n\n        if (supportsSelectionRange(input)) {\n          try {\n            input.setSelectionRange(cursorPosition, cursorPosition)\n          } catch {\n            // Some input types do not support setSelectionRange; fall back to focus only.\n          }\n        }\n        input.focus()\n      },\n      [onPointerDown],\n    )\n\n    const value = useMemo<InputRootContextValue>(\n      () => ({\n        align,\n        disabled,\n        inputRef,\n        invalid: isInvalid,\n        size,\n        styles,\n      }),\n      [align, disabled, isInvalid, size, styles],\n    )\n\n    return (\n      <InputRootContext.Provider value={value}>\n        <div\n          ref={ref}\n          aria-invalid={isInvalid ? true : ariaInvalid}\n          className={cx(styles.root, className)}\n          data-disabled={disabled ? '' : undefined}\n          data-invalid={isInvalid ? '' : undefined}\n          onPointerDown={handlePointerDown}\n          {...props}\n        >\n          {children}\n        </div>\n      </InputRootContext.Provider>\n    )\n  },\n)\n\nInputRoot.displayName = 'InputRoot'\n\nexport interface InputFieldProps extends InputHTMLAttributes<HTMLInputElement> {\n  invalid?: boolean\n}\n\nexport const InputField = forwardRef<HTMLInputElement, InputFieldProps>(\n  ({ 'aria-invalid': ariaInvalid, className, disabled, invalid, type = 'text', ...props }, ref) => {\n    const {\n      disabled: contextDisabled,\n      inputRef,\n      invalid: contextInvalid,\n      styles,\n    } = useInputRootContext('Input.Field')\n    const isDisabled = disabled ?? contextDisabled\n    const ariaInvalidIsTrue = ariaInvalid === true || ariaInvalid === 'true'\n    const isInvalid = invalid ?? (ariaInvalidIsTrue || contextInvalid)\n\n    return (\n      <input\n        ref={composeRefs(ref, inputRef)}\n        aria-invalid={isInvalid ? true : ariaInvalid}\n        className={cx(styles.input, className)}\n        data-invalid={isInvalid ? '' : undefined}\n        disabled={isDisabled}\n        type={type}\n        {...props}\n      />\n    )\n  },\n)\n\nInputField.displayName = 'InputField'\n\nexport interface InputSlotProps extends HTMLAttributes<HTMLDivElement> {\n  side?: InputSlotSide\n}\n\nexport const InputSlot = forwardRef<HTMLDivElement, InputSlotProps>(\n  ({ className, side = 'end', ...props }, ref) => {\n    const { styles } = useInputRootContext('Input.Slot')\n\n    return (\n      <div\n        ref={ref}\n        className={cx(styles.slot, className)}\n        data-side={side}\n        data-stalk-input-slot=\"\"\n        {...props}\n      />\n    )\n  },\n)\n\nInputSlot.displayName = 'InputSlot'\n\nexport const InputPrefix = forwardRef<HTMLDivElement, Omit<InputSlotProps, 'side'>>(\n  (props, ref) => <InputSlot ref={ref} side=\"start\" {...props} />,\n)\n\nInputPrefix.displayName = 'InputPrefix'\n\nexport const InputSuffix = forwardRef<HTMLDivElement, Omit<InputSlotProps, 'side'>>(\n  (props, ref) => <InputSlot ref={ref} side=\"end\" {...props} />,\n)\n\nInputSuffix.displayName = 'InputSuffix'\n\ntype RootOnlyProps = Pick<InputRootProps, 'align' | 'className' | 'invalid' | 'size'>\n\nexport interface InputProps\n  extends\n    RootOnlyProps,\n    Omit<ComponentPropsWithoutRef<typeof InputField>, keyof RootOnlyProps | 'ref'> {\n  endSlot?: ReactNode\n  rootProps?: Omit<InputRootProps, keyof RootOnlyProps | 'children' | 'disabled'>\n  startSlot?: ReactNode\n}\n\nconst InputBase = forwardRef<HTMLInputElement, InputProps>(\n  (\n    {\n      align = 'start',\n      className,\n      disabled = false,\n      endSlot,\n      invalid = false,\n      rootProps,\n      size = 'md',\n      startSlot,\n      ...fieldProps\n    },\n    ref,\n  ) => {\n    return (\n      <InputRoot\n        align={align}\n        className={className}\n        disabled={disabled}\n        invalid={invalid}\n        size={size}\n        {...rootProps}\n      >\n        {startSlot === undefined ? null : <InputSlot side=\"start\">{startSlot}</InputSlot>}\n        <InputField ref={ref} disabled={disabled} {...fieldProps} />\n        {endSlot === undefined ? null : <InputSlot side=\"end\">{endSlot}</InputSlot>}\n      </InputRoot>\n    )\n  },\n)\n\nInputBase.displayName = 'Input'\n\nexport const Input = Object.assign(InputBase, {\n  Field: InputField,\n  Prefix: InputPrefix,\n  Root: InputRoot,\n  Slot: InputSlot,\n  Suffix: InputSuffix,\n})\n"
    }
  ],
  "stalk": {
    "schemaVersion": "1.0",
    "preset": {
      "semanticTokens": {},
      "recipes": ["input"]
    },
    "packageDependencies": {
      "preset": "@stalk-ui/preset"
    },
    "pandaCodegen": true,
    "importAliases": {
      "styledSystem": "styled-system"
    }
  }
}
