{
  "$schema": "https://stalk-ui.com/schema/v1/registry-item.json",
  "name": "tag",
  "type": "registry:ui",
  "dependencies": ["@stalk-ui/preset", "lucide-react"],
  "registryDependencies": ["create-style-context", "tones"],
  "files": [
    {
      "path": "src/components/ui/tag.tsx",
      "type": "registry:ui",
      "content": "'use client'\n\nimport { createStyleContext } from '../../lib/stalk-ui/create-style-context'\nimport { X } from 'lucide-react'\nimport { createContext, forwardRef, useContext, useMemo } from 'react'\nimport { css, cx } from 'styled-system/css'\nimport { tag as tagRecipe } from 'styled-system/recipes'\n\nimport type { Tone } from '../../lib/stalk-ui/tones'\nimport type {\n  ButtonHTMLAttributes,\n  HTMLAttributes,\n  ImgHTMLAttributes,\n  KeyboardEvent as ReactKeyboardEvent,\n  MouseEvent as ReactMouseEvent,\n  ReactNode,\n} from 'react'\n\nexport type TagSize = (typeof tagRecipe.variantMap.size)[number]\nexport type TagVariant = (typeof tagRecipe.variantMap.variant)[number]\nexport type TagRadius = (typeof tagRecipe.variantMap.radius)[number]\nexport type TagTone = Tone\n\nconst { StyleProvider, useSlotStyles, withContext } = /* @__PURE__ */ createStyleContext(\n  tagRecipe,\n  {\n    name: 'Tag',\n  },\n)\n\n// Behavioural context (separate from the slot-style context) so `Tag.Close`\n// inherits the root's `onClose`/`closeAriaLabel`/`disabled` without prop drilling.\ninterface TagContextValue {\n  closeAriaLabel: string\n  disabled: boolean\n  onClose: ((event: ReactMouseEvent<HTMLButtonElement>) => void) | undefined\n}\n\nconst TagContext = /* @__PURE__ */ createContext<TagContextValue | null>(null)\n\nconst useTagContext = (): TagContextValue => {\n  const ctx = useContext(TagContext)\n  if (ctx === null) {\n    throw new Error('Tag subcomponents must be rendered inside <Tag> (TagRoot).')\n  }\n  return ctx\n}\n\nexport interface TagRootProps extends Omit<HTMLAttributes<HTMLSpanElement>, 'onClick'> {\n  /** Render a small leading dot in the palette's solid color. */\n  dot?: boolean\n  /** Disable interaction (click + close) and dim the chip. */\n  disabled?: boolean\n  /** Make the whole chip focusable/clickable with keyboard activation. */\n  onClick?: (event: ReactMouseEvent<HTMLSpanElement>) => void\n  /** Inherited by `Tag.Close`; called when the close button is activated. */\n  onClose?: (event: ReactMouseEvent<HTMLButtonElement>) => void\n  /** Accessible label for `Tag.Close`. Defaults to `Remove`. */\n  closeAriaLabel?: string\n  radius?: TagRadius\n  size?: TagSize\n  /** Selects the semantic color palette. Defaults to `accent`. */\n  tone?: TagTone\n  variant?: TagVariant\n}\n\nexport const TagRoot = /* @__PURE__ */ forwardRef<HTMLSpanElement, TagRootProps>(function TagRoot(\n  {\n    children,\n    className,\n    closeAriaLabel = 'Remove',\n    disabled = false,\n    dot = false,\n    onClick,\n    onClose,\n    onKeyDown,\n    radius = 'full',\n    size = 'md',\n    tone = 'accent',\n    variant = 'subtle',\n    ...props\n  },\n  ref,\n) {\n  const interactive = onClick !== undefined && !disabled\n  const styles = useMemo(\n    () => tagRecipe({ disabled, dot, interactive, radius, size, variant }),\n    [disabled, dot, interactive, radius, size, variant],\n  )\n  const ctx = useMemo<TagContextValue>(\n    () => ({ closeAriaLabel, disabled, onClose }),\n    [closeAriaLabel, disabled, onClose],\n  )\n\n  const handleKeyDown = (event: ReactKeyboardEvent<HTMLSpanElement>) => {\n    onKeyDown?.(event)\n    // `interactive` is only true when `onClick` is defined (aliased condition).\n    if (!interactive || event.defaultPrevented) return\n    if (event.key === 'Enter' || event.key === ' ') {\n      event.preventDefault()\n      onClick(event as unknown as ReactMouseEvent<HTMLSpanElement>)\n    }\n  }\n\n  const interactiveProps = interactive\n    ? ({\n        role: 'button',\n        tabIndex: 0,\n        onClick,\n        onKeyDown: handleKeyDown,\n      } as const)\n    : {}\n\n  return (\n    <StyleProvider value={styles}>\n      <TagContext.Provider value={ctx}>\n        <span\n          ref={ref}\n          className={cx(styles.root, css({ colorPalette: tone }), className)}\n          data-disabled={disabled ? '' : undefined}\n          {...interactiveProps}\n          {...props}\n        >\n          {children}\n        </span>\n      </TagContext.Provider>\n    </StyleProvider>\n  )\n})\n\nexport interface TagAvatarProps extends Omit<HTMLAttributes<HTMLSpanElement>, 'children'> {\n  /** Image source; renders an `<img>` filling the avatar slot. */\n  src?: string\n  /** Alt text for the image (decorative by default). */\n  alt?: string\n  imgProps?: ImgHTMLAttributes<HTMLImageElement>\n  /** Fallback content (e.g. initials) shown when no `src` is provided. */\n  children?: ReactNode\n}\n\nexport const TagAvatar = /* @__PURE__ */ forwardRef<HTMLSpanElement, TagAvatarProps>(\n  function TagAvatar({ alt = '', className, imgProps, src, children, ...props }, ref) {\n    const styles = useSlotStyles()\n    return (\n      <span ref={ref} className={cx(styles.avatar, className)} {...props}>\n        {src ? <img alt={alt} src={src} {...imgProps} /> : children}\n      </span>\n    )\n  },\n)\n\nexport const TagIcon = /* @__PURE__ */ forwardRef<HTMLSpanElement, HTMLAttributes<HTMLSpanElement>>(\n  function TagIcon({ className, ...props }, ref) {\n    const styles = useSlotStyles()\n    return <span ref={ref} aria-hidden=\"true\" className={cx(styles.icon, className)} {...props} />\n  },\n)\n\nexport const TagLabel = /* @__PURE__ */ withContext('span', 'label')\n\nexport const TagCount = /* @__PURE__ */ withContext('span', 'count')\n\nexport type TagCloseProps = ButtonHTMLAttributes<HTMLButtonElement>\n\nexport const TagClose = /* @__PURE__ */ forwardRef<HTMLButtonElement, TagCloseProps>(\n  function TagClose(\n    { 'aria-label': ariaLabel, className, disabled, onClick, type = 'button', ...props },\n    ref,\n  ) {\n    const styles = useSlotStyles()\n    const { closeAriaLabel, disabled: rootDisabled, onClose } = useTagContext()\n    return (\n      <button\n        ref={ref}\n        aria-label={ariaLabel ?? closeAriaLabel}\n        className={cx(styles.close, className)}\n        disabled={disabled ?? rootDisabled}\n        type={type}\n        onClick={(event) => {\n          // Don't bubble to an interactive root (clickable chip).\n          event.stopPropagation()\n          onClick?.(event)\n          onClose?.(event)\n        }}\n        {...props}\n      >\n        <X aria-hidden=\"true\" />\n      </button>\n    )\n  },\n)\n\nexport const Tag = /* @__PURE__ */ Object.assign(TagRoot, {\n  Avatar: TagAvatar,\n  Close: TagClose,\n  Count: TagCount,\n  Icon: TagIcon,\n  Label: TagLabel,\n  Root: TagRoot,\n})\n"
    }
  ],
  "stalk": {
    "schemaVersion": "1.0",
    "preset": {
      "semanticTokens": {},
      "recipes": ["tag"]
    },
    "packageDependencies": {
      "preset": "@stalk-ui/preset"
    },
    "pandaCodegen": true,
    "importAliases": {
      "styledSystem": "styled-system"
    }
  }
}
