{
  "$schema": "https://stalk-ui.com/schema/v1/registry-item.json",
  "name": "password-input",
  "type": "registry:ui",
  "dependencies": ["@stalk-ui/preset", "lucide-react"],
  "registryDependencies": ["input"],
  "files": [
    {
      "path": "src/components/ui/password-input.tsx",
      "type": "registry:ui",
      "content": "'use client'\n\nimport { Eye, EyeOff } from 'lucide-react'\n// Stalk UI component - requires PandaCSS setup and @stalk-ui/preset.\nimport { forwardRef, useCallback, useEffect, useRef, useState } from 'react'\nimport { css } from 'styled-system/css'\n\nimport { Input } from './input'\n\nimport type { InputAlign, InputFieldProps, InputRootProps, InputSize } from './input'\nimport type { Ref } from 'react'\n\nconst toggleButtonStyles = css({\n  alignItems: 'center',\n  appearance: 'none',\n  bgColor: 'transparent',\n  border: 'none',\n  borderRadius: 'sm',\n  color: 'fg.muted',\n  cursor: 'pointer',\n  display: 'inline-flex',\n  flexShrink: 0,\n  justifyContent: 'center',\n  m: 0,\n  p: '2',\n  transitionDuration: 'fast',\n  transitionProperty: 'color, background-color',\n  _hover: { color: 'fg.default' },\n  _focusVisible: {\n    focusRingWidth: 'base',\n    focusRingColor: 'accent.muted',\n    focusRingOffsetWidth: '1',\n    focusRingOffsetColor: 'bg.canvas',\n  },\n  _disabled: { color: 'fg.muted', cursor: 'not-allowed', opacity: 0.6 },\n  '& > svg': { h: '16', w: '16' },\n})\n\nconst mergeRefs =\n  <T,>(...refs: (Ref<T> | undefined)[]) =>\n  (value: T | null) => {\n    for (const ref of refs) {\n      if (typeof ref === 'function') ref(value)\n      else if (ref != null) (ref as { current: T | null }).current = value\n    }\n  }\n\nexport interface PasswordInputProps extends Omit<InputFieldProps, 'type' | 'size'> {\n  align?: InputAlign\n  /** Root className. */\n  className?: string\n  /** Start the field revealed (uncontrolled). Defaults to hidden. */\n  defaultVisible?: boolean\n  /** Accessible label for the reveal button while the password is hidden. */\n  showPasswordLabel?: string\n  /** Accessible label for the reveal button while the password is shown. */\n  hidePasswordLabel?: string\n  invalid?: boolean\n  /** Re-hide the password when the surrounding form submits. Defaults to true. */\n  resetOnSubmit?: boolean\n  rootProps?: Omit<InputRootProps, 'children' | 'className' | 'disabled' | 'size'>\n  size?: InputSize\n}\n\nexport const PasswordInput = /* @__PURE__ */ forwardRef<HTMLInputElement, PasswordInputProps>(\n  function PasswordInput(\n    {\n      align = 'start',\n      className,\n      defaultVisible = false,\n      disabled = false,\n      hidePasswordLabel = 'Hide password',\n      invalid = false,\n      resetOnSubmit = true,\n      rootProps,\n      showPasswordLabel = 'Show password',\n      size = 'md',\n      ...fieldProps\n    },\n    ref,\n  ) {\n    const [visible, setVisible] = useState(defaultVisible)\n    const inputRef = useRef<HTMLInputElement | null>(null)\n\n    // Security affordance: collapse back to hidden once the form is submitted.\n    useEffect(() => {\n      if (!resetOnSubmit) return\n      const form = inputRef.current?.form\n      if (!form) return\n      const handleSubmit = () => {\n        setVisible(false)\n      }\n      form.addEventListener('submit', handleSubmit)\n      return () => {\n        form.removeEventListener('submit', handleSubmit)\n      }\n    }, [resetOnSubmit])\n\n    const toggle = useCallback((event: React.MouseEvent<HTMLButtonElement>) => {\n      const input = inputRef.current\n      const selectionStart = input?.selectionStart ?? null\n      const selectionEnd = input?.selectionEnd ?? null\n      setVisible((prev) => !prev)\n      // Only steal focus back to the field for pointer activation (detail > 0);\n      // keyboard users (Enter/Space, detail === 0) keep focus on the toggle.\n      if (event.detail === 0) return\n      requestAnimationFrame(() => {\n        if (!input) return\n        input.focus()\n        if (selectionStart !== null && selectionEnd !== null) {\n          try {\n            input.setSelectionRange(selectionStart, selectionEnd)\n          } catch {\n            // type=text always supports selection range; guard defensively.\n          }\n        }\n      })\n    }, [])\n\n    return (\n      <Input.Root\n        align={align}\n        className={className}\n        disabled={disabled}\n        invalid={invalid}\n        size={size}\n        {...rootProps}\n      >\n        <Input.Field\n          ref={mergeRefs(ref, inputRef)}\n          autoCapitalize=\"off\"\n          autoComplete={fieldProps.autoComplete ?? 'current-password'}\n          spellCheck={false}\n          type={visible ? 'text' : 'password'}\n          {...fieldProps}\n        />\n        <Input.Suffix>\n          <button\n            aria-label={visible ? hidePasswordLabel : showPasswordLabel}\n            aria-pressed={visible}\n            className={toggleButtonStyles}\n            disabled={disabled}\n            onClick={toggle}\n            type=\"button\"\n          >\n            {visible ? <EyeOff aria-hidden=\"true\" /> : <Eye aria-hidden=\"true\" />}\n          </button>\n        </Input.Suffix>\n      </Input.Root>\n    )\n  },\n)\n"
    }
  ],
  "stalk": {
    "schemaVersion": "1.0",
    "preset": {
      "semanticTokens": {},
      "recipes": []
    },
    "packageDependencies": {
      "preset": "@stalk-ui/preset"
    },
    "pandaCodegen": true,
    "importAliases": {
      "styledSystem": "styled-system"
    }
  }
}
