{
  "$schema": "https://stalk-ui.com/schema/v1/registry-item.json",
  "name": "data-list",
  "type": "registry:ui",
  "dependencies": ["@stalk-ui/preset"],
  "registryDependencies": ["create-style-context"],
  "files": [
    {
      "path": "src/components/ui/data-list.tsx",
      "type": "registry:ui",
      "content": "import { createStyleContext } from '../../lib/stalk-ui/create-style-context'\nimport { forwardRef } from 'react'\nimport { css, cx } from 'styled-system/css'\nimport { dataList as dataListRecipe } from 'styled-system/recipes'\n\nimport type { Tone } from './tones'\nimport type { ComponentPropsWithoutRef } from 'react'\n\nexport type DataListOrientation = (typeof dataListRecipe.variantMap.orientation)[number]\nexport type DataListSize = (typeof dataListRecipe.variantMap.size)[number]\nexport type DataListTone = Tone\n\nexport type DataListRootProps = ComponentPropsWithoutRef<'dl'> & {\n  /** Lay each label/value pair side by side (`horizontal`) or stacked (`vertical`). */\n  orientation?: DataListOrientation\n  /** Text scale applied to labels and values. */\n  size?: DataListSize\n}\n\nconst { useSlotStyles, withContext, withRootProvider } = /* @__PURE__ */ createStyleContext(\n  dataListRecipe,\n  { name: 'DataList' },\n)\n\nexport const DataListRoot = /* @__PURE__ */ withRootProvider('dl')\nexport const DataListItem = /* @__PURE__ */ withContext('div', 'item')\nexport const DataListValue = /* @__PURE__ */ withContext('dd', 'value')\n\nexport type DataListLabelProps = ComponentPropsWithoutRef<'dt'> & {\n  /** Tint the label with a semantic tone. Defaults to the muted neutral text. */\n  tone?: DataListTone\n}\n\nexport const DataListLabel = /* @__PURE__ */ forwardRef<HTMLElement, DataListLabelProps>(\n  function DataListLabel({ className, tone, ...props }, ref) {\n    const styles = useSlotStyles()\n    return (\n      <dt\n        ref={ref}\n        className={cx(\n          styles.label,\n          tone === undefined ? undefined : css({ colorPalette: tone, color: 'colorPalette.text' }),\n          className,\n        )}\n        {...props}\n      />\n    )\n  },\n)\n\nexport const DataList = /* @__PURE__ */ Object.assign(DataListRoot, {\n  Item: DataListItem,\n  Label: DataListLabel,\n  Root: DataListRoot,\n  Value: DataListValue,\n})\n"
    }
  ],
  "stalk": {
    "schemaVersion": "1.0",
    "preset": {
      "semanticTokens": {},
      "recipes": ["dataList"]
    },
    "packageDependencies": {
      "preset": "@stalk-ui/preset"
    },
    "pandaCodegen": true,
    "importAliases": {
      "styledSystem": "styled-system"
    }
  }
}
