{
  "$schema": "https://stalk-ui.com/schema/v1/registry-item.json",
  "name": "carousel",
  "type": "registry:ui",
  "dependencies": ["@stalk-ui/preset", "embla-carousel-react", "lucide-react"],
  "registryDependencies": [],
  "files": [
    {
      "path": "src/components/ui/carousel.tsx",
      "type": "registry:ui",
      "content": "'use client'\n\nimport useEmblaCarousel from 'embla-carousel-react'\nimport { ChevronLeft, ChevronRight } from 'lucide-react'\nimport { createContext, forwardRef, useCallback, useContext, useEffect, useState } from 'react'\nimport { cx } from 'styled-system/css'\nimport { carousel as carouselRecipe } from 'styled-system/recipes'\n\nimport type {\n  ButtonHTMLAttributes,\n  HTMLAttributes,\n  KeyboardEvent as ReactKeyboardEvent,\n} from 'react'\n\ntype UseEmblaParameters = Parameters<typeof useEmblaCarousel>\nexport type CarouselApi = ReturnType<typeof useEmblaCarousel>[1]\nexport type CarouselOptions = UseEmblaParameters[0]\nexport type CarouselPlugin = UseEmblaParameters[1]\nexport type CarouselOrientation = (typeof carouselRecipe.variantMap.orientation)[number]\n\ninterface CarouselContextValue {\n  api: CarouselApi\n  canScrollNext: boolean\n  canScrollPrev: boolean\n  emblaRef: ReturnType<typeof useEmblaCarousel>[0]\n  orientation: CarouselOrientation\n  scrollNext: () => void\n  scrollPrev: () => void\n  styles: ReturnType<typeof carouselRecipe>\n}\n\nconst CarouselContext = createContext<CarouselContextValue | null>(null)\n\nfunction useCarousel(): CarouselContextValue {\n  const context = useContext(CarouselContext)\n  if (context === null) {\n    throw new Error('Carousel parts must be used within <Carousel>.')\n  }\n  return context\n}\n\nexport interface CarouselProps extends HTMLAttributes<HTMLDivElement> {\n  opts?: CarouselOptions\n  orientation?: CarouselOrientation\n  plugins?: CarouselPlugin\n  /** Receives the Embla API once initialized, for external controls. */\n  setApi?: (api: CarouselApi) => void\n}\n\nexport const CarouselRoot = /* @__PURE__ */ forwardRef<HTMLDivElement, CarouselProps>(\n  function CarouselRoot(\n    {\n      'aria-label': ariaLabel = 'Carousel',\n      children,\n      className,\n      opts,\n      orientation = 'horizontal',\n      plugins,\n      setApi,\n      ...props\n    },\n    ref,\n  ) {\n    const [emblaRef, api] = useEmblaCarousel(\n      { ...opts, axis: orientation === 'horizontal' ? 'x' : 'y' },\n      plugins,\n    )\n    const [canScrollPrev, setCanScrollPrev] = useState(false)\n    const [canScrollNext, setCanScrollNext] = useState(false)\n    const styles = carouselRecipe({ orientation })\n\n    const onSelect = useCallback((embla: NonNullable<CarouselApi>) => {\n      setCanScrollPrev(embla.canScrollPrev())\n      setCanScrollNext(embla.canScrollNext())\n    }, [])\n\n    const scrollPrev = useCallback(() => api?.scrollPrev(), [api])\n    const scrollNext = useCallback(() => api?.scrollNext(), [api])\n\n    const onKeyDown = useCallback(\n      (event: ReactKeyboardEvent<HTMLDivElement>) => {\n        if (event.key === 'ArrowLeft') {\n          event.preventDefault()\n          scrollPrev()\n        } else if (event.key === 'ArrowRight') {\n          event.preventDefault()\n          scrollNext()\n        }\n      },\n      [scrollPrev, scrollNext],\n    )\n\n    useEffect(() => {\n      if (api && setApi) setApi(api)\n    }, [api, setApi])\n\n    useEffect(() => {\n      if (!api) return\n      // One-time sync from the imperative Embla API on mount (Embla's own\n      // 'init' has already fired by the time this effect runs). This settles\n      // immediately and does not cascade.\n      // eslint-disable-next-line react-hooks/set-state-in-effect\n      onSelect(api)\n      api.on('reInit', onSelect)\n      api.on('select', onSelect)\n      return () => {\n        api.off('reInit', onSelect)\n        api.off('select', onSelect)\n      }\n    }, [api, onSelect])\n\n    return (\n      <CarouselContext.Provider\n        value={{\n          api,\n          canScrollNext,\n          canScrollPrev,\n          emblaRef,\n          orientation,\n          scrollNext,\n          scrollPrev,\n          styles,\n        }}\n      >\n        <div\n          ref={ref}\n          aria-label={ariaLabel}\n          aria-roledescription=\"carousel\"\n          className={cx(styles.root, className)}\n          role=\"region\"\n          onKeyDownCapture={onKeyDown}\n          {...props}\n        >\n          {children}\n        </div>\n      </CarouselContext.Provider>\n    )\n  },\n)\n\nexport const CarouselContent = /* @__PURE__ */ forwardRef<\n  HTMLDivElement,\n  HTMLAttributes<HTMLDivElement>\n>(function CarouselContent({ className, ...props }, ref) {\n  const { emblaRef, styles } = useCarousel()\n  return (\n    <div ref={emblaRef} className={styles.viewport}>\n      <div ref={ref} className={cx(styles.content, className)} {...props} />\n    </div>\n  )\n})\n\nexport const CarouselItem = /* @__PURE__ */ forwardRef<\n  HTMLDivElement,\n  HTMLAttributes<HTMLDivElement>\n>(function CarouselItem({ className, ...props }, ref) {\n  const { styles } = useCarousel()\n  return (\n    <div\n      ref={ref}\n      aria-roledescription=\"slide\"\n      className={cx(styles.item, className)}\n      role=\"group\"\n      {...props}\n    />\n  )\n})\n\nexport const CarouselPrevious = /* @__PURE__ */ forwardRef<\n  HTMLButtonElement,\n  ButtonHTMLAttributes<HTMLButtonElement>\n>(function CarouselPrevious(\n  { 'aria-label': ariaLabel = 'Previous slide', className, ...props },\n  ref,\n) {\n  const { canScrollPrev, scrollPrev, styles } = useCarousel()\n  return (\n    <button\n      ref={ref}\n      aria-label={ariaLabel}\n      className={cx(styles.previous, className)}\n      disabled={!canScrollPrev}\n      type=\"button\"\n      onClick={scrollPrev}\n      {...props}\n    >\n      <ChevronLeft aria-hidden=\"true\" />\n    </button>\n  )\n})\n\nexport const CarouselNext = /* @__PURE__ */ forwardRef<\n  HTMLButtonElement,\n  ButtonHTMLAttributes<HTMLButtonElement>\n>(function CarouselNext({ 'aria-label': ariaLabel = 'Next slide', className, ...props }, ref) {\n  const { canScrollNext, scrollNext, styles } = useCarousel()\n  return (\n    <button\n      ref={ref}\n      aria-label={ariaLabel}\n      className={cx(styles.next, className)}\n      disabled={!canScrollNext}\n      type=\"button\"\n      onClick={scrollNext}\n      {...props}\n    >\n      <ChevronRight aria-hidden=\"true\" />\n    </button>\n  )\n})\n\ntype CarouselNamespace = typeof CarouselRoot & {\n  Content: typeof CarouselContent\n  Item: typeof CarouselItem\n  Next: typeof CarouselNext\n  Previous: typeof CarouselPrevious\n  Root: typeof CarouselRoot\n}\n\nexport const Carousel: CarouselNamespace = /* @__PURE__ */ Object.assign(CarouselRoot, {\n  Content: CarouselContent,\n  Item: CarouselItem,\n  Next: CarouselNext,\n  Previous: CarouselPrevious,\n  Root: CarouselRoot,\n})\n"
    }
  ],
  "stalk": {
    "schemaVersion": "1.0",
    "preset": {
      "semanticTokens": {},
      "recipes": ["carousel"]
    },
    "packageDependencies": {
      "preset": "@stalk-ui/preset"
    },
    "pandaCodegen": true,
    "importAliases": {
      "styledSystem": "styled-system"
    }
  }
}
